如何看待国学证的考取？,不知道是哪里发的证？感觉最多是象征性的，糊弄下外行普通人。国学按照时下的定义，一切以儒道为首的传统知识文化都应该涵盖在国学范畴，甚至不能纯粹的以专业来概括，更不要说区区一个证书？要钱吗？是不是培训讲座之类，如果感兴趣就参加，但不要看得太重,[]
请问现在国内国学早教市场怎么样。？,早教中心很多，蒙氏早教。以前还有武汉大学冯德全系列的早教书籍和游戏训练书。个人感觉，国学早教市场百花齐放。国学早教机，强调儿童多听多度。有国学书籍套装让孩子和大人一起共读的。大一点的有国学培训班，国学夏令营很多的。成都方面有何要求我不了解，我不是那里人。抱歉！,[]
那些花重金上过国内各种励志、国学、沟通、心理培训课程的人后来怎么样了？,只有两点需要考虑：1、师傅领进门修行在个人2、孔子好教育，弟子有三千，流传下来的贤徒只有72人，现在你知道这些人都干嘛去了把。只有72人上了一圈或两圈其他人该干嘛还是干嘛。所有人都会这样,[]
在博学书院国学班里学习可以有哪些收获？,谢邀。虽说没有去过博学书院，但相关的培训班还是有所了解的，所以个人也来回答一波吧。随着近些年国家对传统文化的逐渐重视，国学热、汉服热、唐装热等悄然兴起。个人感觉国学是一条延续了五千年的中华文明的主线，只不过有时候这条线比较细，不太明显，但却是一直都存在的。现在这条线又逐渐变的明显了。仓廪实而知礼节,衣食足而知荣辱，这是历史发展的必然。因为当国家不断发展、持续兴盛，人们积累了足够的物质文明，精神文明逐渐不匹配物质文明的时候，这时候人们就需要去补充精神养料。而对于源远流长的中华文明来说，这一精神养料就是国学。所以说为什么现在这么多企业家、高管、知识分子……专门去参加国学班，甚至很多小孩子都开始参加少儿国学班。所以，参加博学书院这种国学班更多的是获得一种精神提升：拓宽胸怀格局，提升人生境界。让一个人能够站到一个更高的维度去对待这个世界，不再拘泥于一点一面，思维模式更加宏大宽阔。,[]
如何评价当前社会“国学热”现象？,谢邀。作为一个本科学国学的学生，对这个话题实在是有千言万语……不过幸好，大部分观点都有人说过了，我可以少说点。首先，学国学和爱国毫无关系。学什么能让祖国强大就学什么，而且学好用好，就是爱国了，国学这个专业只是其中微不足道的一个。其次，国学这个概念属于在整个教育体系按照西学分科的情况下，迫不得已的概念。既不包括所有的中国传统文化，也不是与西方研究成果和方法了无交集。因为直说“中国传统文学历史哲学文献学跨学科综合研究方向”实在是太费劲了，估计招生更难了。有人说没必要设立国学这个单独学科，应该并入文史哲，我觉得不是这样的，你可以随便打听文史哲中国方向的学生，他们的经学学习比重多大，我敢说就本科生课程安排来讲，绝对不如国学专精。你再问问他们历史上各种学术对经学功底的要求多高，我敢说没人敢说经学无用。现在西方设计学科也有了很多地域性的跨学科研究，像一般我们留学会主要考虑的“东亚研究”，因为很多东西放在一起研究真的更好更合适。只是国学这个名称歧义略大罢了。再次，民间国学，无论是微信公众号还是培训班还是专门的培训机构甚至取代中小学的那种私人教育……我只能说只要不违法，我实在没办法反对，但是我绝对不看好。想像古人一样生活？做梦吧？耕织自给的古人早就被工业化挤破财饿死街头了，哪儿来的风雅。至于像古时候大户人家那样有文化底蕴，琴棋书画无所不精，你有钱你在哪儿都是贵族，我认识的富二代个个会钢琴会小提琴会围棋会打球会游泳会滑雪，有品位有优雅，出国读个哲学读个文学读个国际政治文化，言不及俗物……这还是他们父辈只靠资本主义做买卖呢，古代那种养家奴建庄园买山而隐出则为王侯将相的，那不就是钱堆出来的么？你以为你挤一身臭汗去上个万人培训班能学出来？至于想要靠国学来培养孩子孝顺女儿三从四德的，可能……人各有志吧……反正我是想不到这些在我们埋头数理化时去学拖地板的人将来得怎么混……当然了还是那句话，家里有钱乐意咱也管不着，但不知道我国义务教育的强制性有多大？再次，各种“国学大师”的畅销书。我觉得看什么书是个人自由，每个人都只能看自己看得懂看的下去的书，反正畅销书都是贴合民众欣赏水平的嘛，没啥可黑的，民众那个水平总也得有书可看……国学，心理学，哲学，经济学，养生，育儿，口才，职场，人脉……唉畅销书嘛都差不多谁也别黑谁了，好歹看这些书的人还是有提高自己的志向的，后面还有看青春文学的一波呢……最后，谈谈国学热。分析其原因，分为几种一，传统保守势力始终都存在，一旦牛鬼蛇神的帽子摘了，他们又敢出来说话了而已，那种依靠“老祖宗的智慧”的人……哪儿都有，真的，不止中国，人人都有祖宗。欧美人保守起来我也害怕。二，因为百年耻辱而激发的逆反心理，想要证明自己的民族文化，仇西仇外，恨不得把中华文明吹上天的皇汉一派……嗯，还是那句话，哪儿都有，你知道中东为啥迟迟不能现代化就明白了。三，因为国家富强了而重新建立的文化自信心，急于构建自己的民族认同感，对外文化输出，这些主要是集中在各种文化产业行内，对传统文化元素的挖掘非常不充分不完整，几乎是中为表西为里的香蕉文化产业，但是迎合潮流啊……这种，没啥可反对的，人家也是发展初期，一步一步来嘛，二十年后这些垃圾都会被淘汰掉的……四，觉得自己能继往圣之绝学的中二青年。对于年轻人有志向，哪怕大而无当，我也是鼓励的，人得有点志向，万一成功了呢。我建议大家为自己的志向多付出一点，不要局限于穿汉服拍艺术照，也不要局限于背两首中学生必背古诗词，我希望大家多读书，多学习，将来可以报考相关专业。譬如国学，是个很新兴的专业，需要优秀人才来开土括疆，请大家在学术上有点追求。五，确实对传统文化有了解也有兴趣的人，想要借鉴古人的智慧，自我修行自我提高，抑或仅做为娱乐品鉴。……挺好的啊，人家是真正有钱有闲者，喜欢听古琴曲还是听交响乐哪儿轮得到我们多说？海纳百川，有容乃大。对于国学，对于支持或反对的诸君，我都只有这一句肺腑之言。,['嗯，真*高质量的文章。武大国学院确实可以，优秀不优秀我们不好说，但是绝对不差。有过一些接触，怎么说呢，首先，你们那边的老师（学生基本没接触），院长好像是郭齐勇教授吧？那些老师，给我的感觉不能说不好，但是总有一种，他们也很迷茫的感觉。真的，虽然，可能当着学生的面说你们老师的不好，好像不大和谐，交流一下倒是无所谓吧？那些老师知道自己要干什么，这一点是没有问题的，但是他们的执着，在我的眼里还是有些莫名，可能我跟他们没有更深一层次的交流有关吧。当然，我觉得这个可能跟国学在当代的定位很奇妙有关系，国学在当代能做什么？和应该做什么？作为一个正经的学术，好像可以，但又有待发展。作为意识形态，好像有些捞过界。作为一种个人修养之道，可以，但是又太唯心。总之，在我有限的脑细胞里，没有找到一个那么切合国学的位置。可能正如此，我才觉得你们老师很怪异，像浮萍一样，渴望稳定自己，确又不得不随波逐流。', '没有什么诋毁的意思，只是私下交流一下我个人的感想。', '把那些乱七八糟的废话抽掉，我要问的就是，国学在当代能做什么和应当做什么？这个你们老师应该也讲过吧？', '啧啧 楼下还有人吐槽国学呢，那么，自然问题又出来了，国学要坚守的是什么？为什么？又，如何坚守？', '我觉得国学是关于如何做人的学问。处理的是自然演化遗传而来的自然人的先天属性与社会演化所需求的社会人的后天属性。先后天的冲突，个体与社会的冲突，如何协调。如需修正，修正哪方，怎么修正，如需培养，怎么培养，……太长，还是另发文比较好。', '看到问题就不由得想了想答案。。谢谢你们的问题，很有启发性，让我跳出国学之外，整体打量了一番国学。', '“老祖宗的智慧”真的很好，越经历多越觉得了不起，当然，只读了几天国学的人是体会不到的。', '您好，我也是一名国学院学生。因为国学热现在很多家长会盲目跟风，带孩子去国学班教育基地。那只是一种传播的方式，并不隶属真正的国学教育。           很多人问学出来了可以做什么，那都是古人的文化，是被打倒过的，适应现在社会吗？      国学包含了千罗万象，半部论语治天下之，只半部论语就如此。四书五经及其他国学项目的益处更无需细说。修身、齐家、治国、平天下一切都与国学经典有关。不是说一定要学国学，而是连自己国家的基本文化都不了解，那不是白活了一遭？国学是越学越想更深入研究的一门学问。只希望现代人可以有激情去了解自己所生活的世界。知晓本末倒置的危害。', '敢问答主，国学究竟包括了哪些文化呢？', '去当老师（教授）罢！', '我觉得大家对这个问题都不要产生迷思就好。人类求知的目的无一例外都是因为迷茫，都是为了求指导、求答案。比方说如果我以为宇宙起源的答案在物理里，我就会去研究物理，学国学也是一个意思。民间出现国学热，也是因为很多人困惑了，想在国学里找到人生的答案。在这里任何一门学问都是工具，不论是中学还是西学。国学老师们也要学会不去板着一副面孔教人一些冷门的知识，而是与大家一道检视一下东、西方文化的差异、中国社会的历史和今天，再看看手中自己所专长的学问，看看能够帮到大家一些什么。', '都在造山头抢制高点', '你们国学到底学什么？诗词歌赋、经史子集还是老庄之道和程朱理学？', '明天期末考试考这题，老师说答案要有底线，即——坚持四项基本原则。', '中肯～', '读国学书有点枯燥，应该怎么读']
为什么反对国学？,<h2>论社会上反对国学四大观点：复古论、无用论、混乱论、冲突论</h2><b>作者支持国学，但总结社会上反对国学四大观点有：复古论、无用论、混乱论、冲突论。并且反对并不都是反对国学本身，而是反对国学各种乱象。</b><figure><noscript><img src="https://pic2.zhimg.com/v2-ebaddd2738a67e9ee16f3128bb93de05_b.jpg" data-caption="" data-size="normal" data-rawwidth="640" data-rawheight="432" data-default-watermark-src="https://pic4.zhimg.com/v2-edbcf76a6452f9699046e57db275d47f_b.jpg" class="origin_image zh-lightbox-thumb" width="640" data-original="https://pic2.zhimg.com/v2-ebaddd2738a67e9ee16f3128bb93de05_r.jpg"></noscript><img src="data:image/svg+xml;utf8,&lt;svg%20xmlns='http://www.w3.org/2000/svg'%20width='640'%20height='432'&gt;&lt;/svg&gt;" data-caption="" data-size="normal" data-rawwidth="640" data-rawheight="432" data-default-watermark-src="https://pic4.zhimg.com/v2-edbcf76a6452f9699046e57db275d47f_b.jpg" class="origin_image zh-lightbox-thumb lazy" width="640" data-original="https://pic2.zhimg.com/v2-ebaddd2738a67e9ee16f3128bb93de05_r.jpg" data-actualsrc="https://pic2.zhimg.com/v2-ebaddd2738a67e9ee16f3128bb93de05_b.jpg"></figure>前言：作者热爱国学并研究国学，但热爱与研究必须秉承着公正合理科学严谨的态度。而为了做到这点必须跳出国学的局限来“重新审视”国学。作者通过各种国学的批判和认识，总结社会上反对国学的“四大理由”，分别是：“复古论”“无用论”“混乱论”和“冲突论”。反对观点如下：<b>一、国学“复古论”</b>历史总是向前的，而历史的车轮不可逆转，我们活在现代就该有现代化的生活，不必“复辟”到古代，不必一切都遵照古代，不合理不合时宜的复古是历史的倒退。比如汉服来说，汉服作为中华文化和中华文明的一部分。汉服的复兴也体现中华文化与文明的复兴，但是实际来讲，汉服已经不太适应现代化的生活，不可能平日里全中国人都要着汉服去学习和工作，所以全面推广汉服不合适也不合时宜。不过汉服可以作为传统节日的节日服装进行宣传式的推广，传统且优秀的东西官方可以适度宣传推广，并凭个人爱好选择。<figure><noscript><img src="https://pic1.zhimg.com/v2-df772e8cb0f8fd3b01bd26182207b1f8_b.jpg" data-caption="" data-size="normal" data-rawwidth="500" data-rawheight="300" data-default-watermark-src="https://pic2.zhimg.com/v2-4dfddf005d48dc8e696c64bfe84480a9_b.jpg" class="origin_image zh-lightbox-thumb" width="500" data-original="https://pic1.zhimg.com/v2-df772e8cb0f8fd3b01bd26182207b1f8_r.jpg"></noscript><img src="data:image/svg+xml;utf8,&lt;svg%20xmlns='http://www.w3.org/2000/svg'%20width='500'%20height='300'&gt;&lt;/svg&gt;" data-caption="" data-size="normal" data-rawwidth="500" data-rawheight="300" data-default-watermark-src="https://pic2.zhimg.com/v2-4dfddf005d48dc8e696c64bfe84480a9_b.jpg" class="origin_image zh-lightbox-thumb lazy" width="500" data-original="https://pic1.zhimg.com/v2-df772e8cb0f8fd3b01bd26182207b1f8_r.jpg" data-actualsrc="https://pic1.zhimg.com/v2-df772e8cb0f8fd3b01bd26182207b1f8_b.jpg"></figure>严重复古的像女德班国学馆。脱离现实、脱离现代，严重扰乱社会风气。而社会上对国学的反对，就是对过时传统的反对。国学也一样，不能盲目简单复古。一方面继承传统，另一方面也要与时俱进，实现国学的现代化。比如“国学管理”在国学现代化中，就很有成效和潜力，将国学和现代管理进行适合且恰当的结合，为现代管理提供中国智慧和方案。<b>二、国学“无用论”</b><b>用国学无用的观点来批判国学，我认为是对国学的“苛刻”和“误解”。</b>认为国学无用首先是对国学的苛刻国学是中国之文化学术，且是传统的历史的文化和学术。如果要用西方“科学”解读和评价国学，我认为是毫无道理的。文化和科学本身就有所区别，中西方文化和科学也有些区别。有人将国学中能否产生科学或科技，来批判国学的有用和无用是愚蠢的。就像将古希腊哲学、古印度文化和马克思主义等中“是否能产生科学”来判断其价值一样愚蠢。<b>三、国学混乱论</b>国学混乱体现在：国学大师称号、国学培训、伪国学、非主流国学等方面。<b>（一）国学大师名号满天飞，有辱大师称号</b><figure><noscript><img src="https://pic1.zhimg.com/v2-733f2468f55eac6d75cc10016b9693e0_b.jpg" data-caption="" data-size="normal" data-rawwidth="640" data-rawheight="280" data-default-watermark-src="https://pic1.zhimg.com/v2-b4a943e5d4189f32229ce8cc01484d5c_b.jpg" class="origin_image zh-lightbox-thumb" width="640" data-original="https://pic1.zhimg.com/v2-733f2468f55eac6d75cc10016b9693e0_r.jpg"></noscript><img src="data:image/svg+xml;utf8,&lt;svg%20xmlns='http://www.w3.org/2000/svg'%20width='640'%20height='280'&gt;&lt;/svg&gt;" data-caption="" data-size="normal" data-rawwidth="640" data-rawheight="280" data-default-watermark-src="https://pic1.zhimg.com/v2-b4a943e5d4189f32229ce8cc01484d5c_b.jpg" class="origin_image zh-lightbox-thumb lazy" width="640" data-original="https://pic1.zhimg.com/v2-733f2468f55eac6d75cc10016b9693e0_r.jpg" data-actualsrc="https://pic1.zhimg.com/v2-733f2468f55eac6d75cc10016b9693e0_b.jpg"></figure>国学大师名号滥用，懂得一些国学智慧，做一些国学宣传的不一定是国学大师。相反天天在媒体上宣传国学，怎么能沉下心去研究国学。甚至如翟鸿燊之流打着国学的幌子进行营销牟利的，真的在糟蹋国学，愚弄和忽悠大众侮辱国学大师的称号。“国学大师的称号，如果用滥了，慢慢会失去它的价值。”<figure><noscript><img src="https://pic1.zhimg.com/v2-b6df3423e5f38539e01258d1cb0c19bc_b.jpg" data-caption="" data-size="normal" data-rawwidth="640" data-rawheight="681" data-default-watermark-src="https://pic2.zhimg.com/v2-911fcedef8589038e756d246bc4b327d_b.jpg" class="origin_image zh-lightbox-thumb" width="640" data-original="https://pic1.zhimg.com/v2-b6df3423e5f38539e01258d1cb0c19bc_r.jpg"></noscript><img src="data:image/svg+xml;utf8,&lt;svg%20xmlns='http://www.w3.org/2000/svg'%20width='640'%20height='681'&gt;&lt;/svg&gt;" data-caption="" data-size="normal" data-rawwidth="640" data-rawheight="681" data-default-watermark-src="https://pic2.zhimg.com/v2-911fcedef8589038e756d246bc4b327d_b.jpg" class="origin_image zh-lightbox-thumb lazy" width="640" data-original="https://pic1.zhimg.com/v2-b6df3423e5f38539e01258d1cb0c19bc_r.jpg" data-actualsrc="https://pic1.zhimg.com/v2-b6df3423e5f38539e01258d1cb0c19bc_b.jpg"></figure><b>（二）启蒙国学是国学，但不是主流国学。</b>非主流国学是国学，但不是主流国学。如果将非主流国学奉为主流，就是本末倒置。背诗猜成语，把三字经奉为国学经典，难道是把中国人当做了三岁小孩吗？启蒙国学起到启蒙的作用，真恐怕担不起“一国之学问”的重担吧！如果打着国学的旗号，把思想陈旧和内容浅薄的“千百三弟”：《千字文》《百家姓》《三字经》《弟子规》奉为圭臬、把博大的《道德经》《论语》和《大学》《中庸》束之高阁，那岂不是本末倒置？<figure><noscript><img src="https://pic3.zhimg.com/v2-7d7888968a969da6ce78c5422a9dbb9e_b.jpg" data-caption="" data-size="normal" data-rawwidth="640" data-rawheight="349" data-default-watermark-src="https://pic3.zhimg.com/v2-3ff81c0e33fbbf1315d564a12009d3fa_b.jpg" class="origin_image zh-lightbox-thumb" width="640" data-original="https://pic3.zhimg.com/v2-7d7888968a969da6ce78c5422a9dbb9e_r.jpg"></noscript><img src="data:image/svg+xml;utf8,&lt;svg%20xmlns='http://www.w3.org/2000/svg'%20width='640'%20height='349'&gt;&lt;/svg&gt;" data-caption="" data-size="normal" data-rawwidth="640" data-rawheight="349" data-default-watermark-src="https://pic3.zhimg.com/v2-3ff81c0e33fbbf1315d564a12009d3fa_b.jpg" class="origin_image zh-lightbox-thumb lazy" width="640" data-original="https://pic3.zhimg.com/v2-7d7888968a969da6ce78c5422a9dbb9e_r.jpg" data-actualsrc="https://pic3.zhimg.com/v2-7d7888968a969da6ce78c5422a9dbb9e_b.jpg"></figure><b>（三）伪国学与国学相近，但不是真正的国学，是假的国学！</b>我们要警惕封建迷信思想借国学热死灰复燃社会上确实有一些人由于对中国传统文化知之甚少，分不清其中的精华与糟粕，经常误把封建迷信思想也当作国学。在国学热中，有些就像老梁说的解读经典复读的方式进行灌迷魂汤差不多。<figure><noscript><img src="https://pic4.zhimg.com/v2-60a369e00e63b68c3ccf4c46c38b39f7_b.jpg" data-caption="" data-size="normal" data-rawwidth="576" data-rawheight="555" data-default-watermark-src="https://pic1.zhimg.com/v2-fdc8ffe77c126b1951a27ff718f95728_b.jpg" class="origin_image zh-lightbox-thumb" width="576" data-original="https://pic4.zhimg.com/v2-60a369e00e63b68c3ccf4c46c38b39f7_r.jpg"></noscript><img src="data:image/svg+xml;utf8,&lt;svg%20xmlns='http://www.w3.org/2000/svg'%20width='576'%20height='555'&gt;&lt;/svg&gt;" data-caption="" data-size="normal" data-rawwidth="576" data-rawheight="555" data-default-watermark-src="https://pic1.zhimg.com/v2-fdc8ffe77c126b1951a27ff718f95728_b.jpg" class="origin_image zh-lightbox-thumb lazy" width="576" data-original="https://pic4.zhimg.com/v2-60a369e00e63b68c3ccf4c46c38b39f7_r.jpg" data-actualsrc="https://pic4.zhimg.com/v2-60a369e00e63b68c3ccf4c46c38b39f7_b.jpg"></figure><b>（四）国学培训打着国学的名号，实际上是招摇撞骗，诈骗钱财</b>总之，批评国学热的多是批评借国学名义而谋取私利的人，借文化复兴之名行文化复辟之实。以国学或传统文化之名形成的社会乱象，最终只会将国学或传统文化搞臭搞烂。而国学乱象是批判国学最主要的原因。很多人不是批判国学，而是批判国学乱象。<b>四、国学冲突论（中西冲突和古今冲突）</b><b>（一）中西冲突，就是建立中国国学会增加文明冲突</b>有人认为当是国学的提出和建立，就是为了对抗西方文化，防止西学东渐，体现一种中西方文化的冲突。但文化的差异不是因为学术设立与否而就能抹平和消灭的，反而将自己国家学问学科化体系化，诞生集中成果，利于文化相互学习和交流。我认为国学是国家学问之集大成，假如美国也有美国学的话，一个想要了解美国历史文化和学问的人只要学习美国学就方便多了。同样，西方人要想了解中国历史文化和学问只要学习研究中国国学。<figure><noscript><img src="https://pic1.zhimg.com/v2-bddde7a0097d5efbfca448f3a9fc612c_b.jpg" data-caption="" data-size="normal" data-rawwidth="640" data-rawheight="411" data-default-watermark-src="https://pic4.zhimg.com/v2-4f4dce2550b19a2d680226d59ffa7f5f_b.jpg" class="origin_image zh-lightbox-thumb" width="640" data-original="https://pic1.zhimg.com/v2-bddde7a0097d5efbfca448f3a9fc612c_r.jpg"></noscript><img src="data:image/svg+xml;utf8,&lt;svg%20xmlns='http://www.w3.org/2000/svg'%20width='640'%20height='411'&gt;&lt;/svg&gt;" data-caption="" data-size="normal" data-rawwidth="640" data-rawheight="411" data-default-watermark-src="https://pic4.zhimg.com/v2-4f4dce2550b19a2d680226d59ffa7f5f_b.jpg" class="origin_image zh-lightbox-thumb lazy" width="640" data-original="https://pic1.zhimg.com/v2-bddde7a0097d5efbfca448f3a9fc612c_r.jpg" data-actualsrc="https://pic1.zhimg.com/v2-bddde7a0097d5efbfca448f3a9fc612c_b.jpg"></figure><b>（二）古今冲突，中国国学与现代科学文化的矛盾冲突</b>文章前面也提到科学和科技是有用，但不能成为文化是否有价值的唯一标准。如果将一种文化是否能诞生科学和科技、以及文化的科学性作为判断文化的价值，是对文化的苛刻。但是按照现代科学的标准，我们的国学是否经得起“推敲”呢？不科学不文明的国学内容，怎么能让人信服？所以当前的国学发展应该坚持科学原则，继续将传统国学和现代学科进行融合，让国学赋予新的内涵，让国学更加科学可信！<figure><noscript><img src="https://pic4.zhimg.com/v2-c961b1af7494a43b7b5e43a5d7257f97_b.jpg" data-caption="" data-size="normal" data-rawwidth="640" data-rawheight="355" data-default-watermark-src="https://pic4.zhimg.com/v2-da57d64695477123ccb221a582662d13_b.jpg" class="origin_image zh-lightbox-thumb" width="640" data-original="https://pic4.zhimg.com/v2-c961b1af7494a43b7b5e43a5d7257f97_r.jpg"></noscript><img src="data:image/svg+xml;utf8,&lt;svg%20xmlns='http://www.w3.org/2000/svg'%20width='640'%20height='355'&gt;&lt;/svg&gt;" data-caption="" data-size="normal" data-rawwidth="640" data-rawheight="355" data-default-watermark-src="https://pic4.zhimg.com/v2-da57d64695477123ccb221a582662d13_b.jpg" class="origin_image zh-lightbox-thumb lazy" width="640" data-original="https://pic4.zhimg.com/v2-c961b1af7494a43b7b5e43a5d7257f97_r.jpg" data-actualsrc="https://pic4.zhimg.com/v2-c961b1af7494a43b7b5e43a5d7257f97_b.jpg"></figure><b>结语和总结</b>作者支持国学、热爱和研究国学，而有的人反对国学有其合理性，而反对其实很多在反对国学的“缺陷”和“乱象”，而反对声音的提出有利于国学自身的发展，国学的发展只有正视自身缺陷和发展乱象，才能使国学朝着正确的方向良性发展。,['文字结构优美，写得非常好！', '汉服已经不太适应现代化的生活，不可能平日里全中国人都要着汉服去学习和工作。偏见……学习是可以穿的，服务行业也是可以穿的，逛街可以穿，在家刷剧可以穿。你说的不适合工作穿也只是那种体力活，古人在劳动的时候也不穿这种的啊。', '不管什么学，都是好好潜心做学问比较好，少些形式主义和噱头，更不要来忽悠和强迫别人。']
