各位知道哪有卖中小学国学教师培训教材的吗？,一般而言很少有系统的教材，需要你自行归纳起来！但是也有一些加盟代理商，可以选择购买他们产品！,[]
厚望斋国学培训主要有哪些课程？,厚望斋的双螺旋课程体系，涵盖学前到高三各个阶段，有周末、暑假班。之前孩子一直上的暑假班，作文写得比以前好很多。 ,[]
发现这样一所国学学校，它的课程安排请参见下文，有没有大神可以对这样的课程分析评价下呢？,我以前几乎不看国学的，后来有一天碰到了阳明心学。第一次入手就被它震撼了。然后就是道德经、金刚经，再接着看四书五经。刚开始一个小时，后来看4个小时都没问题。学国学有个循序渐进的过程。你的课程大纲，如果是培训的课还很贵的话，你慎重。我只能说，你可以找自己看的下去的国学书，一本一本的学习，到最后你自己有受益了，才会有兴趣学下去。四书五经学通了，人生会发生很大的变化。随喜你！,['什么变化，得道升仙了吗？']
大家觉得国学早教哪家好，该怎么选择,孩子今年刚入幼儿园，打算给孩子报个国学培训班？,上早教我选京典思塾，学习国学更要选京典思塾，早教国学京典思塾应该是专业中的专业&#13;,[]
为什么国学家普遍寿命很长？,学国学治百病？题主你是搞国学培训的吧？,[]
想开一所国学培训学校 起什么样的名字有深度且有内涵？,想了解国学学校相关事宜,[]
当前国学早教培训市场正处于百花齐放百家争鸣的时代，各阶段、各类型的品牌层出不穷？,京典思塾六大加盟优势  确保加盟无忧医学与教育完美结合致力于“0-8岁孩子自身发育从孕期到成长至成熟的中华教育模式.实力雄厚中国关心下一代工作委员会核心素养教育研究院课程体系多样化教育通过全方位研发，全新打造“四驱教育”模式解决社会存在的普遍问题科学评估 给予孩子适合的全脑开发按大脑发展设计三大课程:医学课、创立课、儿童成长局（能力课）课程多样化 全方位促进大脑发育思塾艺术课 思塾厨艺课 思塾音乐课  思塾英语课 根据评测结果设定课程结构全程扶持从选址到开业  保姆式扶持  0经验轻松做校长,[]
想要创办一家少儿国学馆，哪家好？希望过来人给点建议,我做了6年国学培训，可以加我微信了解下,[]
免费食宿的国学培训班是如何盈利的？,私信给我  讲下情况 可以的话我会帮助你揭发黑暗,[]
公司要举行一个大型的国学文化培训之类全年的活动，比如说论道，书法大赛，国学夏令营之类，需要什么条件啊,谢邀，我胸无点墨，也没组织过什么活动，好惶恐，我给个方便后面回答者的建议吧。你们是什么公司，做这个活动的目的是什么，做到什么程度（国学文化层次挺多的，总要有个定位），你们的经费多少，经费是怎么筹集的，活动参与人数大概有多少，你把这些信息补充说明一下，回答者看了方便回答，不浪费时间，你也更好获得需要的观点。,[]
哪里有可以线上培训国学老师的机构？,“谦牧在线”，国学专业人才培训的机构，直接上网收搜即可。,[]
有同学去培训了正和智慧国学班教练，也就是(正和领袖)，这个靠谱么？,不管是不是来知乎营销的，还是答一波，看法如下：1、国学班培训，大部分都是不学无术，炒炒概念；2、我不知道怎么定义国学，范围是什么。不能定义的东西，最好远离，等定义清楚之后再判断不迟。3、尽管不知道怎么定义，但从乌七八糟的培训班传播的内容看，拿糟粕当精华，拿无知当有趣，拿权谋当领导力大有人在。4、教练是一种引导提问的技术，教练技术就是教练技术，加上国学教练，就是堆砌了两个概念的不知道什么的东西，再加上智慧、班，就堆了五个概念了，堆了这么多，也不知道啥意思，基本上可以视为骗子。5、千万不要相信洗脑式、控制式的教练技术，前者有汇才的尸体，后者有前仆后继地死在洗脑课堂上的骸骨。6、领袖是不能培养的，正如大多数领导者无法培养一样，相信参加了一个培训班，就可以当领袖，那你要不是真傻，要不是装傻，智商应该不超过80。7、祝愿所有洗脑班招不到生，尽管是不可能的，因为傻子太多。8、希望所有人鼓吹国学的，能亲身试验，言行一致，捧着本草纲目，养到七窍生烟，羽化归天。,[]
,幼儿园导入国学担心教师国学专业跟不上！？老师没有信心教好孩子？至德国学国学教师培训会，5天打造幼儿园国学教师团队！        国学幼儿教师骨干密训营终于如期在北京开幕啦！想想帝都那烟雾朦胧的清晨，小编为各位园长老师的毅力深感敬佩，路漫漫其修远兮，吾将上下而求索。          俗话说一日之计在于晨，我们的密训营自然也是赶了个大早，八点半便开始签到入场了，来自五湖四海的园长老师们相聚一堂，只是相互并不认识，彼此间淡漠疏离，好在早上在胡嘉颖老师的主持下，老师们很快便打破了隔阂，宽大的教师里其乐融融。        不知各位对于我们的现在国学专业水平处于的阶段有所认识吗？是向往 认同 行动？还是专业 引领？静是一种沉淀，非宁静无以致远。徐子周老师的《国学幼师骨干成长规划》给了大家一个全新的视角，让大家轻装上阵，在愉快中学习。          大家都是怀着一颗对国学文化的向往之心而来，可是文化与经典的真正含义到底是什么，恐怕鲜有人知，高凡老师的《中华优秀传统文化基本概论》则为大家这一疑惑做出了回答。        还记得当初那个吸引你成为老师的理由吗？晚间的《中华民族的师道精神》，带领老师们回到最初的起点，巧妙的将古代对师者的态度与现今结合，让大家更好的了解什么是师道精神。          晚上的课程八点半就结束了，向来给孩子们布置作业的老师们今天也有自己写作业啦！         “用天之道，分地之利，谨身节用……”翌日在朗朗书声中开启，晨读是清晨的第一支歌，每日的拜孔晨读，早已不仅是一种仪式，更是一种心灵上的洗礼。           风趣幽默的高凡老师仅用一天的时间就俘获了大家的心，他和他的小故事成了每一位老师的期待。就算是《童蒙养正与幼儿国学教育启蒙》这样严肃的课，也能被他讲的妙趣横生。老师们在欢笑中领悟了“熏陶就是教育，环境就是课堂，习惯就是素质，修养就是能力。”这句话的深刻含义。       我们向来强调“以礼待人”“衣冠礼乐”，可是这个我们每天挂在嘴边的“礼”不仅做起来难，解释起来好像更难，到底什么是礼？礼乐不仅仅只是一种形式，更体现了一种本源，一种对生命的尊重。礼的本质是自信，而乐的本质是自得。《礼乐文化与教师心灵涵养》从个人修养的宏观层面为大家表现了“修身养性”          下午的后半节课是由胡嘉颖老师为大家讲解的《幼儿国学教师行仪规范》，言传身教是最好的教学，只有自己约束好了自己，做到了“礼”才有资格去教导孩子守礼，孩子们才会信服。         晚上徐子周老师和大家一起度过了分享讨论 复讲总结的轻松时光，子曰：“温故而知新，可以为师矣。”相信大家在“温故”之后都能把这两天所学嚼烂消化，使之成为自己的骨血，这样回到幼儿园之后才能更好的“为师”。更多国学教师培训精彩内容，请搜索<a href="http://link.zhihu.com/?target=http%3A//www.158zd.com" class=" wrap external" target="_blank" rel="nofollow noreferrer">“至德国学”</a>关注了解!,[]
中小企业如何做好企业培训呢？, 谢邀。<h2>把培训写进员工心里</h2>工欲善其事，必先利其器。  首先，我们要了解什么是培训。从大的方面来说，培训可以理解为人力资源开发的中心环节——育。而从小的方面说，培训即是指为提高员工胜任力而实施的有步骤、有计划的介入行为。  对于我们企业来说，培训就是为了<b>提高企业员工的素质和能力，帮助公司的战略目标达成</b>。  为了实现这个目标，需要建立配套的<b>培训的课程、培训的讲师以及培训工作的运作</b>。同时也需要相应的软硬件支持，比如公司政策和培训的制度流程、培训设备场地等等。  这是培训建设的基本框架，另外，这两周各位老师已经讲了很多关于培训的知识，不知道大家学到了多少呢？  这里我也给大家安利一个小小的知识点吧，那就是基本的<b>培训方法论——ADDIE</b><figure><noscript><img src="https://pic1.zhimg.com/v2-8793e5745f007fa4b0f7a7fa875d0120_b.jpg" data-caption="" data-size="normal" data-rawwidth="500" data-rawheight="463" data-default-watermark-src="https://pic3.zhimg.com/v2-b2811ca44a4a0abff4244f64385c7866_b.jpg" class="origin_image zh-lightbox-thumb" width="500" data-original="https://pic1.zhimg.com/v2-8793e5745f007fa4b0f7a7fa875d0120_r.jpg"></noscript><img src="data:image/svg+xml;utf8,&lt;svg%20xmlns='http://www.w3.org/2000/svg'%20width='500'%20height='463'&gt;&lt;/svg&gt;" data-caption="" data-size="normal" data-rawwidth="500" data-rawheight="463" data-default-watermark-src="https://pic3.zhimg.com/v2-b2811ca44a4a0abff4244f64385c7866_b.jpg" class="origin_image zh-lightbox-thumb lazy" width="500" data-original="https://pic1.zhimg.com/v2-8793e5745f007fa4b0f7a7fa875d0120_r.jpg" data-actualsrc="https://pic1.zhimg.com/v2-8793e5745f007fa4b0f7a7fa875d0120_b.jpg"></figure>  ADDIE是指一套有系统地发展教学的方法。  主要包含了：  要学什么?(学习目标的制定)；  如何去学?(学习策略的运用)；  以及如何判断学习者已到达学习成效?(学习效果评量的实施)。  在ADDIE五个阶段中，分析与设计属前提，开发与实施是核心，评估为保证，三者互为联系，密不可分。  参考此模型，企业培训工作主要呈现为：<b>需求分析、课程开发、讲师培养、计划制定、培训实施、培训评估、监察改进、制度运维</b>  在这一框架和思路下，培训实施又可以划分为简单的四小步<figure><noscript><img src="https://pic1.zhimg.com/v2-a1d7570b53181f13644ea277d33dba64_b.jpg" data-caption="" data-size="normal" data-rawwidth="603" data-rawheight="136" data-default-watermark-src="https://pic1.zhimg.com/v2-8349cb510cdc5289d1b30a79230d353c_b.jpg" class="origin_image zh-lightbox-thumb" width="603" data-original="https://pic1.zhimg.com/v2-a1d7570b53181f13644ea277d33dba64_r.jpg"></noscript><img src="data:image/svg+xml;utf8,&lt;svg%20xmlns='http://www.w3.org/2000/svg'%20width='603'%20height='136'&gt;&lt;/svg&gt;" data-caption="" data-size="normal" data-rawwidth="603" data-rawheight="136" data-default-watermark-src="https://pic1.zhimg.com/v2-8349cb510cdc5289d1b30a79230d353c_b.jpg" class="origin_image zh-lightbox-thumb lazy" width="603" data-original="https://pic1.zhimg.com/v2-a1d7570b53181f13644ea277d33dba64_r.jpg" data-actualsrc="https://pic1.zhimg.com/v2-a1d7570b53181f13644ea277d33dba64_b.jpg"></figure><b>培训需求：</b>  根据公司年度的任务目标和长期愿景来分解，再结合各个部门的实际需求，最后提炼而成。<b>培训计划：</b>  计划编制的原则——5W2H<figure><noscript><img src="https://pic2.zhimg.com/v2-48ec5cd58962d34a52e3368ed061bbc9_b.jpg" data-caption="" data-size="normal" data-rawwidth="925" data-rawheight="232" data-default-watermark-src="https://pic4.zhimg.com/v2-3974337aa099fb6d230832fc8f2ebcbf_b.jpg" class="origin_image zh-lightbox-thumb" width="925" data-original="https://pic2.zhimg.com/v2-48ec5cd58962d34a52e3368ed061bbc9_r.jpg"></noscript><img src="data:image/svg+xml;utf8,&lt;svg%20xmlns='http://www.w3.org/2000/svg'%20width='925'%20height='232'&gt;&lt;/svg&gt;" data-caption="" data-size="normal" data-rawwidth="925" data-rawheight="232" data-default-watermark-src="https://pic4.zhimg.com/v2-3974337aa099fb6d230832fc8f2ebcbf_b.jpg" class="origin_image zh-lightbox-thumb lazy" width="925" data-original="https://pic2.zhimg.com/v2-48ec5cd58962d34a52e3368ed061bbc9_r.jpg" data-actualsrc="https://pic2.zhimg.com/v2-48ec5cd58962d34a52e3368ed061bbc9_b.jpg"></figure>  通过培训资源的确认，然后结合公司年度、月度以及公司级、部门级的交叉细分需求，最终形成公司月度培训计划，各部门月度培训计划，网络课程资源和外部培训资源等。<b>培训实施：</b>  关于实施，本周一二的打卡如何做好企业内训、外训中，各位老师已经讲述得很详细了，我就不在细述了，一首打油诗送给大家。<b>课前通知要趁早，</b><b>  教材讲义签到表。</b><b>  外出培训要申请，</b><b>  培训记录不可少。</b>  这里着重说一下<b>培训记录</b>的问题，一场培训，不能课堂开开心心，课后过眼烟云。因此需要做好培训的归档工作，要做到——<b>规范合理、有序有效。</b>  那么具体需要归档哪些资料呢？根据内外不同又可以细分为一下8类：<b>在岗培训——在岗培训统计表、签到表、电子课件、试卷、成绩单</b><b>  外出培训——外出培训申请表、外出培训统计表、外出培训总结记录</b>  如图所示<figure><noscript><img src="https://pic2.zhimg.com/v2-a71911d3c759be8cf144521407506e85_b.jpg" data-caption="" data-size="normal" data-rawwidth="257" data-rawheight="225" data-default-watermark-src="https://pic3.zhimg.com/v2-49e9c8d1a35cb7bf10ee5b76817a1a5e_b.jpg" class="content_image" width="257"></noscript><img src="data:image/svg+xml;utf8,&lt;svg%20xmlns='http://www.w3.org/2000/svg'%20width='257'%20height='225'&gt;&lt;/svg&gt;" data-caption="" data-size="normal" data-rawwidth="257" data-rawheight="225" data-default-watermark-src="https://pic3.zhimg.com/v2-49e9c8d1a35cb7bf10ee5b76817a1a5e_b.jpg" class="content_image lazy" width="257" data-actualsrc="https://pic2.zhimg.com/v2-a71911d3c759be8cf144521407506e85_b.jpg"></figure>  具体的文件就不要找我要了哦，都是些很简单的表格，大家也要动脑筋自己学着做~<b>培训评估：</b>  关于培训评估，用的最多的理论就是柯氏四级培训评估，这个话题可以单独再写一篇了，咱们下次再细聊~  借助这一套基本的框架流程，剩下的就简单啦，从必不可少的新员工入职培训（上一篇文章简单写了一个流程，之前新员工培训那次打卡准备具体写，没抽出时间就搁置了）开始，再到各部门的岗位培训，每个部门都指定一位引导人（可以不是直接主管，但必须是一个可以清楚介绍公司和岗位职责且有带动性的人）。  后来又根据公司的发展，不断加入了一些诸如“如何快速融入团队”，“如何做一个受欢迎的员工”的特色培训和“员工职业规划”“人才梯队建设与人才培养”的职业培训。因材施教，小公司的培训也能从零开始做的有滋有味~  好了，以上就是我对培训工作的一些浅显的认识啦，最后，再给大家讲讲今天的重点，如何让培训深入人心？  我觉得，最重要的一点，培训一定要获得高层的支持，自上而下的推行方能水到渠成。  相较于理论，我更喜欢分享一个故事。  这个案例就是中广核集团的“黄金人”。上世纪80年代，我国核电事业刚起步，大亚湾核电站建成后极度缺乏能够运营核电站的高级管理、运行人才。为了自主运营，集团从全国各地电力系统、核工业系统以及大学毕业生中按三倍于实际需要的比例招聘人员，对其进行技术和外语训练，优胜劣淘，最后选送法国、英国进行培训，结果以每人平均130万法郎（按当时的汇率合人民币约195万元，且仅为培训费用）的耗费培训出了112名管理和运行操纵人员。<b>如果按当时的金价折算成等值的黄金，其重量接近一个人的体重，后来有人戏称他们是“黄金人”，核电“黄金人”的说法便由此而出。</b>下图就是这批从20多岁到40多岁年龄参差不齐的培训人员。<figure><noscript><img src="https://pic3.zhimg.com/v2-0c680d8b80ed635d6018ccc9f2fc0fa6_b.jpg" data-caption="" data-size="normal" data-rawwidth="640" data-rawheight="416" data-default-watermark-src="https://pic3.zhimg.com/v2-7630b34e2dd1840bae626d7393cb31e2_b.jpg" class="origin_image zh-lightbox-thumb" width="640" data-original="https://pic3.zhimg.com/v2-0c680d8b80ed635d6018ccc9f2fc0fa6_r.jpg"></noscript><img src="data:image/svg+xml;utf8,&lt;svg%20xmlns='http://www.w3.org/2000/svg'%20width='640'%20height='416'&gt;&lt;/svg&gt;" data-caption="" data-size="normal" data-rawwidth="640" data-rawheight="416" data-default-watermark-src="https://pic3.zhimg.com/v2-7630b34e2dd1840bae626d7393cb31e2_b.jpg" class="origin_image zh-lightbox-thumb lazy" width="640" data-original="https://pic3.zhimg.com/v2-0c680d8b80ed635d6018ccc9f2fc0fa6_r.jpg" data-actualsrc="https://pic3.zhimg.com/v2-0c680d8b80ed635d6018ccc9f2fc0fa6_b.jpg"></figure><b>“黄金人”之于核电，不仅意味着“黄金般的学费”，更意味着“黄金般的作用”。</b>他们学成回国后成了大亚湾核电站生产运行、管理的骨干力量，为电站取得辉煌的业绩发挥了很大的作用。也正是他们的亲身经历，中广核集团深知培训的重要性，因此始终把培训工作放在非常重要的战略地位，也正是这种理念，使得我国的核电技术日新月异，就在刚刚结束的博鳌论坛上，中广核董事长表示我们已经“从核电的门外汉，变成了核电技术、装备的输出国。”  很庆幸，我老板被我成功"洗脑"，毕竟培训的作用这么好，我申请的培训费用又少。因此，公司的管理层也都非常支持培训工作，很多时候北京的领导同事过来出差，遇到我们有培训课都会主动申请来旁听~  本来之前写在这里就要结束了，不过昨天刚刚看到一个故事，又忍不住想分享给大家。   《百家姓》开篇赵钱孙李，赵是当时皇帝姓氏，为何钱排第二，正是因为故事的主角——<b>吴越钱氏家族。</b>  俗话说，富不过三代，孟子也说：君子之泽，五世而斩。可钱氏家族彻底颠覆了人们的想象，到近代，更是爆发，人才井喷。钱氏人口仅占我国全部人口千分之二，但自宋代以来，载入史册的钱氏名人就已逾千。据统计，当代国内外仅科学院院士以上的，钱氏名人就有一百多位，分布于世界五十多个国家。<b>有人总结钱家出过：一诺奖、二外交家、三科学家、四国学大师、五全国政协副主席、十八两院院士。钱穆、钱钟书、钱学森、钱伟长、这些如雷贯耳的人名，居然都是一家人，都是钱氏家族！</b>  不少研究学者认为，是因钱家有着不同常人的DNA。可事实却是因为钱氏注重培训！原来，当年家主钱镠曾说“子孙虽愚，诗书须读”。<b>所以，从宋代开始，钱氏家族就族内相互扶携，并明文规定家族的一部分田产或盈利，必须作为教育经费。钱姓子弟不分贫富都能上学。</b>  如果把钱氏家族看做一个企业，那当企业领导人确立了培训的传统，并通过时间的推移深入企业人心，每人都养成爱好学习，相互分享的习惯，何愁人才不可得，事业不可成？  就像我们现在的公司，老板愿意做培训，管理层支持做培训，在这样自上而下的氛围下，员工也开始慢慢接受并适应，从台下的听众变为台上的讲师，还把主动培训分享纳入了绩效考核加分项，提高了大家主动分享的积极性，一点一滴，培训深入人心。  培训工作，润物细无声，却任重而道远。身为培训人，我只想说：俏也不争春，只把春来报，待到业绩都达标，尔在丛中笑。,[]
,,[]
